{
  "provider": "voximplant",
  "account_id": "YOUR_VOXIMPLANT_ACCOUNT_ID",
  "api_key": "YOUR_VOXIMPLANT_API_KEY",
  "application_id": "YOUR_APPLICATION_ID",
  "rule_id": "YOUR_INBOUND_RULE_ID",
  "phone_number_e164": "+79001234567",
  "webhook_secret": "GENERATE_WITH_openssl_rand_hex_32",
  "operator_transfer_e164": "+79007654321",
  "voice_id": "default",
  "language": "ru-RU",
  "record_calls": true,
  "disclaimer_played": true
}
